[
  {
    "kind": "wincraft.activity.draft",
    "schema_version": "draft-2026-10-29",
    "source_type": "codex",
    "device_id": "fixture-device",
    "provider_id": "fixture.codex",
    "mapping_version": "1",
    "source_instance_id": "fixture-codex-instance",
    "session_id": "fixture-parent",
    "parent_session_id": null,
    "task_id": "fixture-parent-task",
    "display_name": "Harness A",
    "model_name": "Fixture Model X",
    "source_status": "turn.running",
    "normalized_status": "running",
    "observed_at": "2026-10-29T10:00:00Z",
    "expires_at": "2026-10-29T10:05:00Z",
    "source_sequence": 1,
    "freshness": "fresh",
    "authority": "source",
    "summary": "Synthetic parent session",
    "control_capabilities": [],
    "provenance": "synthetic"
  },
  {
    "kind": "wincraft.activity.draft",
    "schema_version": "draft-2026-10-29",
    "source_type": "codex",
    "device_id": "fixture-device",
    "provider_id": "fixture.codex",
    "mapping_version": "1",
    "source_instance_id": "fixture-codex-instance",
    "session_id": "fixture-child-running",
    "parent_session_id": "fixture-parent",
    "task_id": "fixture-task-running",
    "display_name": "Harness A",
    "model_name": "Fixture Model X",
    "source_status": "turn.running",
    "normalized_status": "running",
    "observed_at": "2026-10-29T10:00:01Z",
    "expires_at": "2026-10-29T10:05:01Z",
    "source_sequence": 2,
    "freshness": "fresh",
    "authority": "source",
    "summary": "Synthetic running child task",
    "control_capabilities": [],
    "provenance": "synthetic"
  },
  {
    "kind": "wincraft.activity.draft",
    "schema_version": "draft-2026-10-29",
    "source_type": "codex",
    "device_id": "fixture-device",
    "provider_id": "fixture.codex",
    "mapping_version": "1",
    "source_instance_id": "fixture-codex-instance",
    "session_id": "fixture-child-stale",
    "parent_session_id": "fixture-parent",
    "task_id": "fixture-task-stale",
    "display_name": "Harness A",
    "model_name": "Fixture Model X",
    "source_status": "connection.lost",
    "normalized_status": "stale",
    "observed_at": "2026-10-29T09:59:00Z",
    "expires_at": "2026-10-29T10:01:00Z",
    "source_sequence": 4,
    "freshness": "disconnected",
    "authority": "source",
    "summary": "Synthetic disconnected child task",
    "control_capabilities": [],
    "provenance": "synthetic"
  },
  {
    "kind": "wincraft.activity.draft",
    "schema_version": "draft-2026-10-29",
    "source_type": "claude-code",
    "device_id": "fixture-device",
    "provider_id": "fixture.claude",
    "mapping_version": "1",
    "source_instance_id": "fixture-claude-instance",
    "session_id": "fixture-waiting",
    "parent_session_id": null,
    "task_id": "fixture-task-waiting",
    "display_name": "Harness A",
    "model_name": "Fixture Model X",
    "source_status": "Notification",
    "normalized_status": "waiting_input",
    "observed_at": "2026-10-29T10:00:02Z",
    "expires_at": "2026-10-29T10:05:02Z",
    "source_sequence": 1,
    "freshness": "fresh",
    "authority": "adapter_mapping",
    "summary": "Synthetic input request; no response action is available",
    "control_capabilities": [],
    "provenance": "synthetic"
  }
]
